{
  "usgs_id": "us7000tdms",
  "estado": "publicado",
  "mag": 5.9,
  "lon": -109.0117,
  "lat": -34.8796,
  "depth_km": 10.0,
  "lugar": "southern East Pacific Rise",
  "origen_utc": "2026-09-02T12:35:56Z",
  "versiones_procesadas": {
    "shakemap": 4,
    "groundfailure": 0
  },
  "timestamps": {
    "detectado": "2026-09-02T13:00:25Z",
    "publicado": "2026-09-02T14:11:03Z",
    "publicado_ultimo": "2026-09-28T15:46:55Z",
    "usgs_origen": "2026-09-02T12:35:56Z"
  },
  "hashes": {},
  "intentos_preliminar": 0,
  "backtest": false,
  "notas": [
    "ShakeMap v0 -> v1",
    "ShakeMap v1 -> v2",
    "reproceso forzado: el pipeline cambio, no los productos",
    "reproceso forzado: el pipeline cambio, no los productos",
    "ShakeMap v2 -> v3",
    "reproceso forzado: el pipeline cambio, no los productos",
    "reproceso forzado: el pipeline cambio, no los productos",
    "ShakeMap v3 -> v4",
    "reproceso forzado: el pipeline cambio, no los productos"
  ]
}
