{
  "usgs_id": "us7000tdmp",
  "estado": "descartado",
  "mag": 5.6,
  "lon": -93.0157,
  "lat": 14.3228,
  "depth_km": 11.0,
  "lugar": "77 km al SO de Puerto Madero, México",
  "origen_utc": "2026-09-02T12:28:31Z",
  "versiones_procesadas": {
    "shakemap": 6,
    "groundfailure": 0
  },
  "timestamps": {
    "descartado": "2026-10-05T16:11:59Z",
    "detectado": "2026-09-02T12:50:23Z",
    "preliminar": "2026-09-02T12:50:54Z",
    "publicado": "2026-09-02T13:57:37Z",
    "publicado_ultimo": "2026-09-25T10:31:00Z",
    "usgs_origen": "2026-09-02T12:28:31Z"
  },
  "hashes": {},
  "intentos_preliminar": 1,
  "backtest": false,
  "notas": [
    "sin ShakeMap disponible aun",
    "reproceso forzado: el pipeline cambio, no los productos",
    "ShakeMap v2 -> v3",
    "reproceso forzado: el pipeline cambio, no los productos",
    "ShakeMap v3 -> v4",
    "reproceso forzado: el pipeline cambio, no los productos",
    "reproceso forzado: el pipeline cambio, no los productos",
    "reproceso forzado: el pipeline cambio, no los productos",
    "ShakeMap v4 -> v6",
    "epicentro en mar abierto, fuera de la caja de todos los paises cubiertos"
  ]
}
