{
  "usgs_id": "us6000tymj",
  "estado": "publicado",
  "mag": 5.6,
  "lon": -86.5063,
  "lat": 9.7526,
  "depth_km": 8.0,
  "lugar": "94 km al SO de Tamarindo, Costa Rica",
  "origen_utc": "2026-09-30T21:55:27Z",
  "versiones_procesadas": {
    "shakemap": 5,
    "groundfailure": 0
  },
  "timestamps": {
    "despachado": "2026-10-01T04:10:19Z",
    "detectado": "2026-09-30T22:10:21Z",
    "preliminar": "2026-09-30T22:10:48Z",
    "publicado": "2026-09-30T22:16:01Z",
    "publicado_ultimo": "2026-10-01T00:01:01Z",
    "usgs_origen": "2026-09-30T21:55:27Z"
  },
  "hashes": {},
  "intentos_preliminar": 1,
  "backtest": false,
  "notas": [
    "sin ShakeMap disponible aun",
    "ShakeMap v0 -> v1",
    "ShakeMap v1 -> v2",
    "ShakeMap v2 -> v4",
    "ShakeMap v4 -> v5"
  ]
}
